{
  "schema_version": 1,
  "site_id": "site_playground",
  "environment": "production",
  "version": 2,
  "updated_at": "2026-09-24T12:00:00Z",
  "enabled": true,
  "allowed_origins": ["https://www.example.com"],
  "ingest_keys": [
    {
      "key_id": "ik_12345678",
      "sha256_digest": "aaaaaaaaaaaaaaaaaaaaaaaaaaaaaaaaaaaaaaaaaaaaaaaaaaaaaaaaaaaaaaaa",
      "created_at": "2026-09-24T12:00:00Z"
    }
  ],
  "rate_limit_per_minute": 600
}
